{
  "schema_version": 1,
  "derivation_id": "audit-categories-02x8-20261005",
  "source_commit": "a04446e57ec1fbc252a871afcec7752fb2807b14",
  "created_at": "2026-10-05T01:11:28.694255+00:00",
  "tool": {
    "id": "stacks-zh-derive",
    "version": "2"
  },
  "origin_commit": "fcb4dd2bec09179740f61a601588d678becf578a",
  "files": {
    "input_units": {
      "path": "translation-data/retired/derivations/audit-categories-02x8-20261005/units.jsonl",
      "hash": "sha256:d41d0c88c936ec917cb17784589cc7024d799f17f377daa546f2c3903239c2fe"
    },
    "input_candidates": {
      "path": "translation-data/retired/derivations/audit-categories-02x8-20261005/candidates.jsonl",
      "hash": "sha256:c682475cf3551f2af1518eb9a29baaca9e1628f67a581941c279941aff1ef412"
    },
    "output_units": {
      "path": "translation-data/units/categories-02X8.jsonl",
      "hash": "sha256:9992b7f0a05bf982cca0ec784e03f89d2d766522e7c0fcb74faa9f1321140b6f"
    },
    "output_candidates": {
      "path": "translation-data/candidates/openai-gpt-5.6-sol/categories-02X8.jsonl",
      "hash": "sha256:f7960af2ee06cd5e1ed9867ad8f928b66f3da3b2a694d48e31de3b1ed1688169"
    }
  },
  "unit_id_map": {
    "tag:02X8:title": "tag:02X8:title",
    "tag:02X8:p001": "tag:02X8:p001",
    "tag:02X8:definition": "tag:003I:definition",
    "tag:02X8:example": "tag:003K:example",
    "tag:02X8:p002": "tag:02X8:p002",
    "tag:02X8:remark": "tag:003M:remark"
  },
  "operations": [
    {
      "unit_id": "tag:02X8:title",
      "kinds": [
        "model-revision",
        "term-display"
      ],
      "reason": "Use the statement’s locked permanent Tag; protect the complete source italic grouping where required; apply the complete frozen actual revision with exact-source bilingual terms, preserving pending status and source TeX.",
      "unit_updates": {},
      "candidate_updates": {
        "allowed_english": [],
        "notes": [],
        "term_occurrences": [
          {
            "source_term": "categories",
            "target_term": "范畴"
          }
        ],
        "translation": "(2, 1)-范畴（categories）",
        "unknown_terms": [
          {
            "context": "锁定来源 tag:02X8:title：Section 标题中的范畴词汇核心；数值限定 (2, 1) 保留。本次提议译法为“范畴”；词表尚无批准，待术语维护者决定。",
            "source_term": "categories",
            "target_term": "范畴"
          }
        ]
      },
      "model_correction_id": "review-categories-02x8-20261005"
    },
    {
      "unit_id": "tag:02X8:p001",
      "kinds": [
        "model-revision",
        "term-display"
      ],
      "reason": "Use the statement’s locked permanent Tag; protect the complete source italic grouping where required; apply the complete frozen actual revision with exact-source bilingual terms, preserving pending status and source TeX.",
      "unit_updates": {},
      "candidate_updates": {
        "allowed_english": [],
        "notes": [],
        "term_occurrences": [
          {
            "source_term": "categories",
            "target_term": "范畴"
          },
          {
            "source_term": "morphisms",
            "target_term": "态射"
          },
          {
            "source_term": "isomorphisms",
            "target_term": "同构"
          }
        ],
        "translation": "<STRUCT_0001>\n某些<MATH_0001>-范畴（categories）具有如下性质：其所有<MATH_0002>-态射（morphisms）都是同构（isomorphisms）。它们将在下文中发挥重要作用，并且更便于处理。",
        "unknown_terms": [
          {
            "context": "锁定来源 tag:02X8:p001：介绍所有 2-态射均为同构的 2-范畴。本次提议译法为“范畴”；词表尚无批准，待术语维护者决定。",
            "source_term": "categories",
            "target_term": "范畴"
          },
          {
            "context": "锁定来源 tag:02X8:p001：介绍所有 2-态射均为同构的 2-范畴。本次提议译法为“态射”；词表尚无批准，待术语维护者决定。",
            "source_term": "morphisms",
            "target_term": "态射"
          },
          {
            "context": "锁定来源 tag:02X8:p001：介绍所有 2-态射均为同构的 2-范畴。本次提议译法为“同构”；词表尚无批准，待术语维护者决定。",
            "source_term": "isomorphisms",
            "target_term": "同构"
          }
        ]
      },
      "model_correction_id": "review-categories-02x8-20261005"
    },
    {
      "unit_id": "tag:02X8:definition",
      "kinds": [
        "model-revision",
        "term-display",
        "coordinates"
      ],
      "reason": "Use the statement’s locked permanent Tag; protect the complete source italic grouping where required; apply the complete frozen actual revision with exact-source bilingual terms, preserving pending status and source TeX.",
      "unit_updates": {},
      "candidate_updates": {
        "allowed_english": [],
        "notes": [],
        "term_occurrences": [
          {
            "source_term": "strict",
            "target_term": "严格"
          },
          {
            "source_term": "category",
            "target_term": "范畴"
          },
          {
            "source_term": "category",
            "target_term": "范畴"
          },
          {
            "source_term": "morphisms",
            "target_term": "态射"
          },
          {
            "source_term": "isomorphisms",
            "target_term": "同构"
          }
        ],
        "translation": "一个（严格（strict）的）<TEXTITOPEN_0001><MATH_0001>-范畴（category）<TEXTITCLOSE_0001>是一个<MATH_0002>-范畴（category），其中所有<MATH_0003>-态射（morphisms）都是同构（isomorphisms）。",
        "unknown_terms": [
          {
            "context": "锁定来源 tag:003I:definition：严格 (2, 1)-范畴的定义条件。本次提议译法为“严格”；词表尚无批准，待术语维护者决定。",
            "source_term": "strict",
            "target_term": "严格"
          },
          {
            "context": "锁定来源 tag:003I:definition：严格 (2, 1)-范畴的定义条件。本次提议译法为“范畴”；词表尚无批准，待术语维护者决定。",
            "source_term": "category",
            "target_term": "范畴"
          },
          {
            "context": "锁定来源 tag:003I:definition：严格 (2, 1)-范畴的定义条件。本次提议译法为“态射”；词表尚无批准，待术语维护者决定。",
            "source_term": "morphisms",
            "target_term": "态射"
          },
          {
            "context": "锁定来源 tag:003I:definition：严格 (2, 1)-范畴的定义条件。本次提议译法为“同构”；词表尚无批准，待术语维护者决定。",
            "source_term": "isomorphisms",
            "target_term": "同构"
          }
        ]
      },
      "model_correction_id": "review-categories-02x8-20261005"
    },
    {
      "unit_id": "tag:02X8:example",
      "kinds": [
        "model-revision",
        "term-display",
        "coordinates"
      ],
      "reason": "Use the statement’s locked permanent Tag; protect the complete source italic grouping where required; apply the complete frozen actual revision with exact-source bilingual terms, preserving pending status and source TeX.",
      "unit_updates": {},
      "candidate_updates": {
        "allowed_english": [],
        "notes": [],
        "term_occurrences": [
          {
            "source_term": "category",
            "target_term": "范畴"
          },
          {
            "source_term": "Remark",
            "target_term": "注"
          },
          {
            "source_term": "category",
            "target_term": "范畴"
          },
          {
            "source_term": "functors",
            "target_term": "函子"
          },
          {
            "source_term": "isomorphisms",
            "target_term": "同构"
          },
          {
            "source_term": "morphisms",
            "target_term": "态射"
          }
        ],
        "translation": "<MATH_0001>-范畴（category）<MATH_0002>（见注（Remark）<REF_0001>）可以变成一个<MATH_0003>-范畴（category），只需仅允许函子（functors）的同构（isomorphisms）作为<MATH_0004>-态射（morphisms）。",
        "unknown_terms": [
          {
            "context": "锁定来源 tag:003K:example：将 Cat 的 2-态射限制为函子的同构。本次提议译法为“范畴”；词表尚无批准，待术语维护者决定。",
            "source_term": "category",
            "target_term": "范畴"
          },
          {
            "context": "锁定来源 tag:003K:example：将 Cat 的 2-态射限制为函子的同构。本次提议译法为“注”；词表尚无批准，待术语维护者决定。",
            "source_term": "Remark",
            "target_term": "注"
          },
          {
            "context": "锁定来源 tag:003K:example：将 Cat 的 2-态射限制为函子的同构。本次提议译法为“函子”；词表尚无批准，待术语维护者决定。",
            "source_term": "functors",
            "target_term": "函子"
          },
          {
            "context": "锁定来源 tag:003K:example：将 Cat 的 2-态射限制为函子的同构。本次提议译法为“同构”；词表尚无批准，待术语维护者决定。",
            "source_term": "isomorphisms",
            "target_term": "同构"
          },
          {
            "context": "锁定来源 tag:003K:example：将 Cat 的 2-态射限制为函子的同构。本次提议译法为“态射”；词表尚无批准，待术语维护者决定。",
            "source_term": "morphisms",
            "target_term": "态射"
          }
        ]
      },
      "model_correction_id": "review-categories-02x8-20261005"
    },
    {
      "unit_id": "tag:02X8:p002",
      "kinds": [
        "model-revision",
        "term-display",
        "protected-extraction"
      ],
      "reason": "Use the statement’s locked permanent Tag; protect the complete source italic grouping where required; apply the complete frozen actual revision with exact-source bilingual terms, preserving pending status and source TeX.",
      "unit_updates": {
        "placeholders": {
          "MATH_0001": "$2$",
          "MATH_0002": "$\\mathcal{C}$",
          "MATH_0003": "$(2, 1)$",
          "MATH_0004": "$2$",
          "MATH_0005": "$\\mathcal{C}'$",
          "MATH_0006": "$1$",
          "MATH_0007": "$2$",
          "MATH_0008": "$2$",
          "MATH_0009": "$\\mathcal{C}$",
          "MATH_0010": "$\\mathcal{C}'$",
          "MATH_0011": "$(2, 1)$",
          "MATH_0012": "$\\mathcal{C}$",
          "MATH_0013": "$(2, 1)$",
          "MATH_0014": "$2$",
          "MATH_0015": "$1$",
          "MATH_0016": "$2$",
          "STRUCT_0001": "\\noindent",
          "TEXTITOPEN_0001": "{\\it",
          "TEXTITCLOSE_0001": "}"
        },